{"schemaVersion": 1, "page": 3, "timeWindow": "weekend tot 20 uur", "series": {"1100": {"routes": [[[52.08035, 4.32515], [52.07593, 4.3309], [52.07443, 4.33136], [52.07302, 4.32975], [52.06677, 4.31665], [52.06249, 4.31144], [52.05997, 4.30984], [52.05555, 4.30861], [52.05196, 4.30876], [52.04933, 4.30968], [52.04601, 4.31187], [52.04372, 4.31417], [52.0189, 4.34568], [52.01022, 4.35461], [52.00193, 4.35841], [51.9274, 4.39907], [51.92557, 4.40127], [51.92267, 4.40685], [51.92099, 4.41363], [51.92069, 4.41647], [51.92403, 4.46422], [51.92609, 4.47555], [51.92605, 4.47883], [51.92516, 4.48172], [51.91836, 4.49158], [51.91393, 4.49889], [51.90534, 4.50943], [51.86146, 4.54672], [51.85443, 4.5532], [51.84962, 4.55977], [51.84367, 4.57147], [51.83958, 4.57716], [51.83643, 4.57992], [51.83259, 4.58192], [51.81262, 4.58725], [51.80544, 4.58778], [51.79109, 4.58635], [51.7857, 4.58634], [51.77948, 4.58777], [51.77396, 4.59045], [51.76631, 4.59673], [51.75434, 4.60958], [51.73493, 4.63186], [51.72981, 4.63639], [51.66265, 4.68115], [51.65631, 4.68659], [51.60487, 4.72201], [51.60098, 4.72562], [51.59835, 4.72956], [51.59624, 4.73425], [51.59477, 4.73952], [51.59303, 4.74925], [51.59221, 4.75845], [51.5926, 4.76418], [51.59516, 4.77621], [51.59758, 4.82667], [51.59736, 4.83385], [51.56157, 5.07435], [51.55983, 5.09434], [51.56, 5.09722], [51.56178, 5.10692], [51.56706, 5.12844], [51.58499, 5.20709], [51.58945, 5.30502], [51.58918, 5.30931], [51.5885, 5.31197], [51.58686, 5.31541], [51.58159, 5.32322], [51.57936, 5.32568], [51.48329, 5.41354], [51.44382, 5.46587], [51.44262, 5.46898], [51.4422, 5.47244], [51.44244, 5.47676], [51.44322, 5.48142]]]}, "12900": {"routes": [[[52.6994, 5.28632], [52.69519, 5.2445], [52.69522, 5.20932], [52.68634, 5.16118], [52.68234, 5.15137], [52.67714, 5.13477], [52.66788, 5.11121], [52.64811, 5.07505], [52.64462, 5.06021], [52.64543, 5.0528], [52.64536, 5.04749], [52.63989, 5.02244], [52.63895, 5.01993], [52.63702, 5.01688], [52.63508, 5.01515], [52.63286, 5.01425], [52.5856, 5.00442], [52.57577, 5.00272], [52.52824, 4.99772], [52.52419, 4.9966], [52.52264, 4.99552], [52.51693, 4.9871], [52.5156, 4.9842], [52.50923, 4.95985], [52.50792, 4.95789], [52.50051, 4.95094], [52.49957, 4.94844], [52.49831, 4.94071], [52.49397, 4.92858], [52.49156, 4.92423], [52.47878, 4.90571], [52.46411, 4.87404], [52.4623, 4.86734], [52.45682, 4.82712], [52.45662, 4.81686], [52.45583, 4.81424], [52.45337, 4.80942], [52.4515, 4.80767], [52.44941, 4.8075], [52.43842, 4.81386], [52.43403, 4.81542], [52.43136, 4.81573], [52.42745, 4.81459], [52.41455, 4.80572], [52.40933, 4.8036], [52.39989, 4.80292], [52.39686, 4.80418], [52.3945, 4.80629], [52.3925, 4.80925], [52.39096, 4.81286], [52.38996, 4.81695], [52.38923, 4.82268], [52.38918, 4.86969], [52.38877, 4.87403], [52.38584, 4.88344], [52.38301, 4.88911], [52.37897, 4.90035]]]}, "13900": {"routes": [[[51.44322, 5.48142], [51.445, 5.49594], [51.44513, 5.49953], [51.44423, 5.51094], [51.44224, 5.51891], [51.43878, 5.52552], [51.41733, 5.55395], [51.41402, 5.55609], [51.40422, 5.55819], [51.39901, 5.56037], [51.36832, 5.58083], [51.25587, 5.6677], [51.2536, 5.67], [51.2518, 5.67317], [51.25092, 5.67567], [51.25019, 5.67979], [51.24823, 5.71446], [51.24416, 5.77282], [51.23787, 5.84523], [51.23129, 5.89277], [51.22746, 5.95262], [51.22896, 5.96751], [51.22895, 5.9718], [51.22812, 5.97592], [51.22661, 5.97943], [51.21338, 6.00086], [51.21191, 6.00263], [51.20818, 6.00464], [51.20462, 6.00408], [51.20296, 6.00296], [51.19671, 5.99653], [51.18119, 5.98902], [51.1788, 5.98703], [51.11856, 5.88987], [51.11571, 5.88638], [51.11331, 5.88437], [51.0427, 5.85567], [51.03822, 5.85545], [51.00691, 5.86028], [51.00461, 5.86024], [50.99998, 5.85761], [50.9962, 5.85346], [50.99453, 5.85233], [50.98184, 5.8521], [50.97743, 5.85105], [50.97453, 5.84933], [50.9638, 5.84056], [50.95408, 5.83594], [50.95168, 5.8364], [50.94955, 5.83804], [50.94567, 5.844], [50.94404, 5.84738], [50.93808, 5.87976], [50.93604, 5.88495], [50.93415, 5.88731], [50.93226, 5.88863], [50.92063, 5.8923], [50.91929, 5.89358], [50.91744, 5.89652], [50.89572, 5.95882], [50.89288, 5.96608], [50.89168, 5.96988], [50.89086, 5.97501]]]}, "1500": {"routes": [[[52.2574, 6.16045], [52.25913, 6.15577], [52.25897, 6.15248], [52.25682, 6.14784], [52.24678, 6.13316], [52.24567, 6.13098], [52.24448, 6.12706], [52.24214, 6.11292], [52.23735, 6.09719], [52.23174, 6.05276], [52.23053, 6.04725], [52.21925, 6.0173], [52.2095, 5.98599], [52.20895, 5.97924], [52.2094, 5.96512], [52.20875, 5.96069], [52.20681, 5.95577], [52.19135, 5.92341], [52.19009, 5.91953], [52.18933, 5.91531], [52.18933, 5.90732], [52.1938, 5.87816], [52.19511, 5.87341], [52.20042, 5.85905], [52.20141, 5.85276], [52.20135, 5.84761], [52.19043, 5.70375], [52.18405, 5.67249], [52.16288, 5.60714], [52.16228, 5.60438], [52.16265, 5.52974], [52.16234, 5.51367], [52.16767, 5.44105], [52.17231, 5.41131], [52.17245, 5.40697], [52.17151, 5.40152], [52.16945, 5.39691], [52.15414, 5.3775], [52.15359, 5.37489], [52.15354, 5.36197], [52.15441, 5.35813], [52.15559, 5.35599], [52.20493, 5.28735], [52.20749, 5.28326], [52.20878, 5.27936], [52.20923, 5.27654], [52.20945, 5.26002], [52.21002, 5.25385], [52.22102, 5.18955], [52.22252, 5.18535], [52.23014, 5.1785], [52.23948, 5.17313], [52.28242, 5.15654], [52.28568, 5.15409], [52.2876, 5.15103], [52.28891, 5.14719], [52.28938, 5.14435], [52.29212, 5.10178], [52.29294, 5.09607], [52.29448, 5.09076], [52.29936, 5.07932], [52.30599, 5.05514], [52.30768, 5.05136], [52.31391, 5.04087], [52.32171, 5.0245], [52.32582, 5.01482], [52.33133, 4.99961], [52.33625, 4.98872], [52.33975, 4.9825], [52.34187, 4.97778], [52.34609, 4.96483], [52.35916, 4.93343], [52.36041, 4.9319], [52.36172, 4.93115], [52.36433, 4.93089], [52.36893, 4.93318], [52.37071, 4.93321], [52.37223, 4.93254], [52.37389, 4.93052], [52.37481, 4.92778], [52.37695, 4.91377], [52.37698, 4.90638], [52.37897, 4.90035]]]}, "16900": {"routes": [[[50.62444, 5.56664], [50.61947, 5.57338], [50.61796, 5.57629], [50.61677, 5.58234], [50.61743, 5.58463], [50.61855, 5.58576], [50.6216, 5.58678], [50.62794, 5.58603], [50.62912, 5.58678], [50.63106, 5.5894], [50.6347, 5.59096], [50.63675, 5.59253], [50.64019, 5.59781], [50.64261, 5.60379], [50.64883, 5.63321], [50.65067, 5.63909], [50.65272, 5.64319], [50.6566, 5.64903], [50.6585, 5.65109], [50.66184, 5.65369], [50.67133, 5.65942], [50.68469, 5.66994], [50.68813, 5.67336], [50.6914, 5.67537], [50.69706, 5.67731], [50.70552, 5.68368], [50.71344, 5.68636], [50.71914, 5.69195], [50.73072, 5.69428], [50.73961, 5.69236], [50.74642, 5.69417], [50.75003, 5.69635], [50.75385, 5.70042], [50.7806, 5.71457], [50.78543, 5.7161], [50.83708, 5.71776], [50.84084, 5.71551], [50.84629, 5.70735], [50.85028, 5.70561]]]}, "1700": {"routes": [[[52.08035, 4.32515], [52.0773, 4.32903], [52.07614, 4.33118], [52.05696, 4.38733], [52.05419, 4.39646], [52.05287, 4.4049], [52.04718, 4.48309], [52.04553, 4.50035], [52.00863, 4.64862], [52.00834, 4.65365], [52.00903, 4.65934], [52.01022, 4.66327], [52.01472, 4.67181], [52.01624, 4.67586], [52.01715, 4.67998], [52.01827, 4.68896], [52.01369, 4.76272], [52.01399, 4.77287], [52.01525, 4.77985], [52.01734, 4.78629], [52.04047, 4.84181], [52.04329, 4.84747], [52.04676, 4.85207], [52.07854, 4.88235], [52.0807, 4.8849], [52.08342, 4.88934], [52.08567, 4.89506], [52.10054, 4.9401], [52.10522, 4.95585], [52.10608, 4.96447], [52.10597, 4.97027], [52.10038, 5.04115], [52.09967, 5.05568], [52.09664, 5.09625], [52.09599, 5.10051], [52.09473, 5.10435], [52.089, 5.1106], [52.09633, 5.10423], [52.09943, 5.10433], [52.10192, 5.10585], [52.10337, 5.10756], [52.10642, 5.11293], [52.10827, 5.11791], [52.11682, 5.15474], [52.14571, 5.26332], [52.14622, 5.27053], [52.14436, 5.31484], [52.14448, 5.32007], [52.14666, 5.34169], [52.15317, 5.36116], [52.15376, 5.37617], [52.15508, 5.37913], [52.16945, 5.39691], [52.17151, 5.40152], [52.17233, 5.40559], [52.17231, 5.41131], [52.16767, 5.44105], [52.16234, 5.51367], [52.16265, 5.52974], [52.1621, 5.6014], [52.16288, 5.60714], [52.18405, 5.67249], [52.19062, 5.70515], [52.20147, 5.85052], [52.20128, 5.85429], [52.20042, 5.85905], [52.19511, 5.87341], [52.1938, 5.87816], [52.18933, 5.90732], [52.18912, 5.91241], [52.18953, 5.91675], [52.19135, 5.92341], [52.20681, 5.95577], [52.20875, 5.96069], [52.2094, 5.96512], [52.20895, 5.97924], [52.20936, 5.98534], [52.21925, 6.0173], [52.23089, 6.04858], [52.23193, 6.05418], [52.23709, 6.09579], [52.24214, 6.11292], [52.24499, 6.12914], [52.24678, 6.13316], [52.25779, 6.14944], [52.25913, 6.15315], [52.25913, 6.15577], [52.25639, 6.16294], [52.25559, 6.16799], [52.2559, 6.17088], [52.25767, 6.17844], [52.25767, 6.18499], [52.25581, 6.1908], [52.25124, 6.1974], [52.25041, 6.20107], [52.25017, 6.20985], [52.25295, 6.29984], [52.25911, 6.3265], [52.27381, 6.3633], [52.2898, 6.45345], [52.30932, 6.50954], [52.31125, 6.51771], [52.31301, 6.52223], [52.3204, 6.53368], [52.33838, 6.5531], [52.35803, 6.5764], [52.35991, 6.57952], [52.36113, 6.585], [52.36417, 6.63613], [52.36372, 6.64194], [52.36194, 6.64741], [52.36073, 6.64984], [52.35615, 6.65657], [52.35351, 6.65887], [52.34622, 6.66043], [52.3442, 6.66271], [52.32639, 6.69594], [52.31014, 6.73004], [52.30201, 6.74481], [52.26397, 6.78327], [52.26276, 6.78661], [52.2611, 6.79938], [52.25918, 6.80446], [52.22366, 6.86071], [52.22233, 6.86367], [52.22129, 6.86769], [52.22089, 6.87236], [52.22253, 6.88999]]]}, "17800": {"routes": [[[52.20928, 5.97028], [52.20867, 5.98749], [52.20744, 5.99388], [52.20175, 6.01052], [52.16632, 6.12059], [52.15789, 6.14306], [52.14329, 6.16895], [52.14187, 6.17219], [52.14123, 6.17612], [52.14135, 6.17896], [52.14493, 6.19445]]]}, "1800": {"routes": [[[51.44322, 5.48142], [51.44244, 5.47676], [51.4422, 5.47244], [51.44262, 5.46898], [51.44382, 5.46587], [51.48329, 5.41354], [51.57936, 5.32568], [51.58159, 5.32322], [51.58686, 5.31541], [51.5885, 5.31197], [51.58918, 5.30931], [51.58945,